<?xml version="1.0" encoding="UTF-8"?>
<!DOCTYPE control SYSTEM "control.dtd">
<control name="Edit Larger Document (symbols)">
  <alph/>
  
  <node label="&#9209;" color="242">
    <stop/>
    <alph/>
    <root/>
  </node>

  <node name="CTL_MOVE" label="&#10018;" color="-1">
    <node name="CTL_MOVE_BACKWARD" label="&#8678;" color="-1">
      <node label="&#128464;" color="-1">
        <move forward="no" dist="all"/>
        <alph/>
        <ref name="CTL_MOVE_BACKWARD"/>
        <ref name="CTL_MOVE_FORWARD"/>
      </node>
      <node label="&#182;" color="-1">
        <move forward="no" dist="paragraph"/>
        <alph/>
        <ref name="CTL_MOVE_BACKWARD"/>
        <ref name="CTL_MOVE_FORWARD"/>
      </node>
      <node label=".&#8265;" color="-1">
        <move forward="no" dist="sentence"/>
        <alph/>
        <ref name="CTL_MOVE_BACKWARD"/>
        <ref name="CTL_MOVE_FORWARD"/>
      </node>
      <node label="&#11052;" color="-1">
        <move forward="no" dist="word"/>
        <alph/>
        <ref name="CTL_MOVE_BACKWARD"/>
        <ref name="CTL_MOVE_FORWARD"/>
      </node>
      <node label="&#8226;" color="-1">
        <move forward="no" dist="char"/>
        <alph/>
        <ref name="CTL_MOVE_BACKWARD"/>
        <ref name="CTL_MOVE_FORWARD"/>
      </node>
    </node>

    <node name="CTL_MOVE_FORWARD" label="&#8680;" color="-1">

      <node label="&#8226;" color="-1">
        <move forward="yes" dist="char"/>
        <alph/>
        <ref name="CTL_MOVE_BACKWARD"/>
        <ref name="CTL_MOVE_FORWARD"/>
      </node>
      <node label="&#11052;" color="-1">
        <move forward="yes" dist="word"/>
        <alph/>
        <ref name="CTL_MOVE_BACKWARD"/>
        <ref name="CTL_MOVE_FORWARD"/>
      </node>
      <node label=".&#8265;" color="-1">
        <move forward="yes" dist="sentence"/>
        <alph/>
        <ref name="CTL_MOVE_BACKWARD"/>
        <ref name="CTL_MOVE_FORWARD"/>
      </node>
      <node label="&#182;" color="-1">
        <move forward="yes" dist="paragraph"/>
        <alph/>
        <ref name="CTL_MOVE_BACKWARD"/>
        <ref name="CTL_MOVE_FORWARD"/>
      </node>
      <node label="&#128464;" color="-1">
        <move forward="yes" dist="all"/>
        <alph/>
        <ref name="CTL_MOVE_BACKWARD"/>
        <ref name="CTL_MOVE_FORWARD"/>
      </node>
    </node>

  </node>
  
  <node name="CTL_DELETE" label="&#10683;" color="-1">
    <node name="CTL_DELETE_BACKWARD" label="&#9003;" color="-1">
      <node label="&#128464;" color="-1">
        <delete forward="no" dist="all"/>
        <alph/>
        <ref name="CTL_DELETE_BACKWARD"/>
        <ref name="CTL_DELETE_FORWARD"/>
      </node>
      <node label="&#182;" color="-1">
        <delete forward="no" dist="paragraph"/>
        <alph/>
        <ref name="CTL_DELETE_BACKWARD"/>
        <ref name="CTL_DELETE_FORWARD"/>
      </node>
      <node label=".&#8265;" color="-1">
        <delete forward="no" dist="sentence"/>
        <alph/>
        <ref name="CTL_DELETE_BACKWARD"/>
        <ref name="CTL_DELETE_FORWARD"/>
      </node>
      <node label="&#11052;" color="-1">
        <delete forward="no" dist="word"/>
        <alph/>
        <ref name="CTL_DELETE_BACKWARD"/>
        <ref name="CTL_DELETE_FORWARD"/>
      </node>
      <node label="&#8226;" color="-1">
        <delete forward="no" dist="char"/>
        <alph/>
        <ref name="CTL_DELETE_BACKWARD"/>
        <ref name="CTL_DELETE_FORWARD"/>
      </node>
    </node>

    <node name="CTL_DELETE_FORWARD" label="&#8998;" color="-1">

      <node label="&#8226;" color="-1">
        <delete forward="yes" dist="char"/>
        <alph/>
        <ref name="CTL_DELETE_BACKWARD"/>
        <ref name="CTL_DELETE_FORWARD"/>
      </node>
      <node label="&#11052;" color="-1">
        <delete forward="yes" dist="word"/>
        <alph/>
        <ref name="CTL_DELETE_BACKWARD"/>
        <ref name="CTL_DELETE_FORWARD"/>
      </node>
      <node label=".&#8265;" color="-1">
        <delete forward="yes" dist="sentence"/>
        <alph/>
        <ref name="CTL_DELETE_BACKWARD"/>
        <ref name="CTL_DELETE_FORWARD"/>
      </node>
      <node label="&#182;" color="-1">
        <delete forward="yes" dist="paragraph"/>
        <alph/>
        <ref name="CTL_DELETE_BACKWARD"/>
        <ref name="CTL_DELETE_FORWARD"/>
      </node>
      <node label="&#128464;" color="-1">
        <delete forward="yes" dist="all"/>
        <alph/>
        <ref name="CTL_DELETE_BACKWARD"/>
        <ref name="CTL_DELETE_FORWARD"/>
      </node>
    </node>
  </node>

  <alph/>
  
</control>

