<?xml version="1.0" encoding="UTF-8"?>
<!DOCTYPE control SYSTEM "control.dtd">
<control name="Edit Larger Document (ascii)">
  <alph/>
  
  <node label="Stop" color="242">
    <stop/>
    <alph/>
    <root/>
  </node>

  <node name="CTL_MOVE" label="Move" color="-1">
    <node name="CTL_MOVE_BACKWARD" label="&lt;=" color="-1">
      <node label="All" color="-1">
        <move forward="no" dist="all"/>
        <alph/>
        <ref name="CTL_MOVE_BACKWARD"/>
        <ref name="CTL_MOVE_FORWARD"/>
      </node>
      <node label="Para." color="-1">
        <move forward="no" dist="paragraph"/>
        <alph/>
        <ref name="CTL_MOVE_BACKWARD"/>
        <ref name="CTL_MOVE_FORWARD"/>
      </node>
      <node label="Sent." color="-1">
        <move forward="no" dist="sentence"/>
        <alph/>
        <ref name="CTL_MOVE_BACKWARD"/>
        <ref name="CTL_MOVE_FORWARD"/>
      </node>
      <node label="Word" color="-1">
        <move forward="no" dist="word"/>
        <alph/>
        <ref name="CTL_MOVE_BACKWARD"/>
        <ref name="CTL_MOVE_FORWARD"/>
      </node>
      <node label="Char" color="-1">
        <move forward="no" dist="char"/>
        <alph/>
        <ref name="CTL_MOVE_BACKWARD"/>
        <ref name="CTL_MOVE_FORWARD"/>
      </node>
    </node>

    <node name="CTL_MOVE_FORWARD" label="=&gt;" color="-1">

      <node label="Char" color="-1">
        <move forward="yes" dist="char"/>
        <alph/>
        <ref name="CTL_MOVE_BACKWARD"/>
        <ref name="CTL_MOVE_FORWARD"/>
      </node>
      <node label="Word" color="-1">
        <move forward="yes" dist="word"/>
        <alph/>
        <ref name="CTL_MOVE_BACKWARD"/>
        <ref name="CTL_MOVE_FORWARD"/>
      </node>
      <node label="Sent." color="-1">
        <move forward="yes" dist="sentence"/>
        <alph/>
        <ref name="CTL_MOVE_BACKWARD"/>
        <ref name="CTL_MOVE_FORWARD"/>
      </node>
      <node label="Para." color="-1">
        <move forward="yes" dist="paragraph"/>
        <alph/>
        <ref name="CTL_MOVE_BACKWARD"/>
        <ref name="CTL_MOVE_FORWARD"/>
      </node>
      <node label="All" color="-1">
        <move forward="yes" dist="all"/>
        <alph/>
        <ref name="CTL_MOVE_BACKWARD"/>
        <ref name="CTL_MOVE_FORWARD"/>
      </node>
    </node>

  </node>
  
  <node name="CTL_DELETE" label="Delete" color="-1">
    <node name="CTL_DELETE_BACKWARD" label="&lt;x" color="-1">
      <node label="All" color="-1">
        <delete forward="no" dist="all"/>
        <alph/>
        <ref name="CTL_DELETE_BACKWARD"/>
        <ref name="CTL_DELETE_FORWARD"/>
      </node>
      <node label="Para." color="-1">
        <delete forward="no" dist="paragraph"/>
        <alph/>
        <ref name="CTL_DELETE_BACKWARD"/>
        <ref name="CTL_DELETE_FORWARD"/>
      </node>
      <node label="Sent." color="-1">
        <delete forward="no" dist="sentence"/>
        <alph/>
        <ref name="CTL_DELETE_BACKWARD"/>
        <ref name="CTL_DELETE_FORWARD"/>
      </node>
      <node label="Word" color="-1">
        <delete forward="no" dist="word"/>
        <alph/>
        <ref name="CTL_DELETE_BACKWARD"/>
        <ref name="CTL_DELETE_FORWARD"/>
      </node>
      <node label="Char" color="-1">
        <delete forward="no" dist="char"/>
        <alph/>
        <ref name="CTL_DELETE_BACKWARD"/>
        <ref name="CTL_DELETE_FORWARD"/>
      </node>
    </node>

    <node name="CTL_DELETE_FORWARD" label="x&gt;" color="-1">

      <node label="Char" color="-1">
        <delete forward="yes" dist="char"/>
        <alph/>
        <ref name="CTL_DELETE_BACKWARD"/>
        <ref name="CTL_DELETE_FORWARD"/>
      </node>
      <node label="Word" color="-1">
        <delete forward="yes" dist="word"/>
        <alph/>
        <ref name="CTL_DELETE_BACKWARD"/>
        <ref name="CTL_DELETE_FORWARD"/>
      </node>
      <node label="Sent." color="-1">
        <delete forward="yes" dist="sentence"/>
        <alph/>
        <ref name="CTL_DELETE_BACKWARD"/>
        <ref name="CTL_DELETE_FORWARD"/>
      </node>
      <node label="Para." color="-1">
        <delete forward="yes" dist="paragraph"/>
        <alph/>
        <ref name="CTL_DELETE_BACKWARD"/>
        <ref name="CTL_DELETE_FORWARD"/>
      </node>
      <node label="All" color="-1">
        <delete forward="yes" dist="all"/>
        <alph/>
        <ref name="CTL_DELETE_BACKWARD"/>
        <ref name="CTL_DELETE_FORWARD"/>
      </node>
    </node>
  </node>

  <alph/>
  
</control>

