<?xml version="1.0" encoding="UTF-8"?>
<!DOCTYPE control SYSTEM "control.dtd">
<control name="Speak From Prepared Document (ascii)">

  <node name="CTL_MOVE" label="Move" color="-1">
    
    <node name="CTL_MOVE_BACKWARD" label="&lt;=" color="-1">
      <node label="All" color="-1">
        <move forward="no" dist="all"/>
        <ref name="CTL_MOVE"/>
        <ref name="CTL_SPEAK"/>
      </node>
      <node label="Para." color="-1">
        <move forward="no" dist="paragraph"/>
        <ref name="CTL_MOVE"/>
        <ref name="CTL_SPEAK"/>
      </node>
      <node label="Sent." color="-1">
        <move forward="no" dist="sentence"/>
        <ref name="CTL_MOVE"/>
        <ref name="CTL_SPEAK"/>
      </node>
    </node>

    <node name="CTL_MOVE_FORWARD" label="=&gt;" color="-1">

      <node label="Sent." color="-1">
        <move forward="yes" dist="sentence"/>
        <ref name="CTL_MOVE"/>
        <ref name="CTL_SPEAK"/>
      </node>
      <node label="Para." color="-1">
        <move forward="yes" dist="paragraph"/>
        <ref name="CTL_MOVE"/>
        <ref name="CTL_SPEAK"/>
      </node>
      <node label="All" color="-1">
        <move forward="yes" dist="all"/>
        <ref name="CTL_MOVE"/>
        <ref name="CTL_SPEAK"/>
      </node>
    </node>
  </node>

  <node  name="CTL_SPEAK" label="Speak" color="241">

    <node label="Stop" color="242">
      <speak what="cancel"/>
      <ref name="CTL_MOVE"/>
      <ref name="CTL_SPEAK"/>
    </node>
    <node label="Repeat" color="241">
      <speak what="repeat"/>
      <ref name="CTL_MOVE"/>
      <ref name="CTL_SPEAK"/>
    </node>
    <node label="Sent." color="-1">
      <speak what="sentence"/>
      <move forward="yes" dist="sentence"/>
      <ref name="CTL_MOVE"/>
      <ref name="CTL_SPEAK"/>
    </node>
    <node label="Para." color="-1">
      <speak what="paragraph"/>
      <move forward="yes" dist="paragraph"/>
      <ref name="CTL_MOVE"/>
      <ref name="CTL_SPEAK"/>
    </node>
  </node>
</control>

